id,project_id,title,description,budget,applicant_name,apply_date,status,approved_by,approved_date,remark,created_at
624710c7-488c-462d-a438-e1b5db967c32,3007f40a-6d69-454b-b524-cb6331ddbdf9,国家电网总部EMS系统升级项目项目服务器采购申请,项目部署所需服务器、存储设备及网络设备,139.68,刘洋,2023-08-13,executing,张总,2023-08-20,,2023-08-06
4bdf7f2c-c9b1-4c72-8903-e5f2d6ee5370,04d811c0-6df7-4478-94f1-571b207d0b24,南方电网配网自动化建设项目项目服务器采购申请,项目部署所需服务器、存储设备及网络设备,98.94,刘洋,2023-07-02,executing,张总,2023-07-09,,2023-06-25
4682d937-a2f7-44fb-9524-22decd3a51e6,4c29a887-c44a-4ee3-a92a-9b8b956444b1,国网河北电力GIS系统建设项目服务器采购申请,项目部署所需服务器、存储设备及网络设备,37.25,刘洋,2023-12-04,completed,张总,2023-12-11,,2023-11-27
3ea47bd0-1d68-4996-8fb4-9c4df54c272c,555327ad-ce8a-4098-a0c3-19e249ba3c8f,国网山东调度数据网升级改造项目服务器采购申请,项目部署所需服务器、存储设备及网络设备,55.87,刘洋,2023-06-29,executing,张总,2023-07-06,,2023-06-22
a9b14b42-8ec2-498f-914f-09e9b9fc44ba,40c382ee-04e3-4a49-8212-101c9c06815f,国网江苏AMI智能量测体系建设项目服务器采购申请,项目部署所需服务器、存储设备及网络设备,75.66,刘洋,2023-11-21,completed,张总,2023-11-28,,2023-11-14
